Title,Link,Snippet
Belgian bishop distances himself from gay rights award,https://newsinfo.inquirer.net/666484/belgian-bishop-distances-himself-from-gay-rights-award,... birth control. FEATURED STORIES. NEWSINFO. LTO suspends 3 more driving schools for fraudulent certificates. NEWSINFO. Drug war cases 'being ...
Nation | The latest from Inquirer News,https://newsinfo.inquirer.net/category/latest-stories/nation-latest-stories/page/9239,"Duterte against abortion, but all for birth control – even for students. March 11, 2017 BY: Leila B. Salaverria. Nation. Duterte vows not to use PTV for his ..."
Not yet over | Inquirer News,https://newsinfo.inquirer.net/378395/not-yet-over,... birth control medicines and devices? FEATURED STORIES. NEWSINFO. Ex ... condoms being sold over the counter. The drug stores and ...
"Sotto taunts ex-DOH chief: You're callous, insensitive",https://newsinfo.inquirer.net/249865/sotto-blasts-ex-health-chief-for-questioning-his-anti-rh-speech,"She stressed that artificial methods of birth control including condoms, contraceptives and IUDs “have not been shown by scientific methods ..."
Save the Children lauds passage of Positive Discipline Bill,https://newsinfo.inquirer.net/41079/save-the-children-lauds-passage-of-positive-discipline-bill,"... Law and the Revised Penal Code. Article continues after this ... Birth control, information, other bills tackled at Cabinet mee ..."
"He helped topple communism, eschewed pomp",https://newsinfo.inquirer.net/4388/he-helped-topple-communism-eschewed-pomp,"... birth control, euthanasia and abortion—alienated many Catholics ... contraception. Dogged by the scandal of pedophile priests, the Pope ..."
House new RH bill targets foes' concerns,https://newsinfo.inquirer.net/291654/house-new-rh-bill-targets-foes-concerns#!,The changes include giving priority to the poor in the provision of birth control methods and banning contraceptives that prevent the ...
Senate shelves reproductive health bill,https://newsinfo.inquirer.net/75281/senate-shelves-reproductive-health-bill,"“The sponsors have denied that this is for population control, but they're talking of fertility rate. ... birth control. Why are you ..."
Top US boarding school details decades of sexual abuse,https://newsinfo.inquirer.net/889224/top-us-boarding-school-details-decades-of-sexual-abuse,... condoms and forced a student to get birth control pills. Your subscription could not be saved. Please try again. Your subscription has been ...
Santiago defends Ateneo professors on RH bill stand,https://newsinfo.inquirer.net/255938/santiago-defends-ateneo-professors-on-rh-bill-stand,... contraception to poor Filipinos. Condoms and birth control pills are particularly anathema as they supposedly encourage promiscuity ...
No RH vote? Politicians fear ire of local priests,https://newsinfo.inquirer.net/312867/lawmakers-skip-rh-bill-debates-to-avoid-catholic-church-backlash-in-2013-polls,"... birth control pills as abortifacient. The health department supports the bill, saying it would reduce maternal and child deaths in the ..."
Top winner Buhay partylist to press for repeal of RH Law,https://newsinfo.inquirer.net/416579/top-winner-buhay-partylist-to-press-for-repeal-of-rh-law,... law. Article continues after this advertisement. “During our ... condoms and [birth control] pills. Your subscription could not be ...
Pope Francis approves Mother Teresa elevation to sainthood,https://newsinfo.inquirer.net/773942/pope-francis-approves-mother-teresa-elevation-to-sainthood,But she was also a divisive figure with critics branding her a religious imperialist whose fervent opposition to birth control and abortion ...
US health authorities confirm Zika causes birth defects,https://newsinfo.inquirer.net/779504/us-health-authorities-confirm-zika-causes-birth-defects,"“Scientists at the Centers for Disease Control and Prevention have concluded, after careful review of existing evidence, that Zika virus is ..."
Trump doesn't want to talk about Flynn pardon 'yet',https://newsinfo.inquirer.net/952891/trump-doesnt-want-to-talk-about-flynn-pardon-yet,... birth control · No stopping cash aid to Marawi poor–DSWD. EDITORS' PICK. NBA: Chris Paul makes exhibition debut with Spurs · Julie Anne San ...
"US health care law works in some ways, comes up short in ...",https://newsinfo.inquirer.net/883743/us-health-care-law-works-in-some-ways-comes-up-short-in-others,"The benefits are considered especially important for women, since birth control and other routine services are now covered as preventive care, ..."
CDC: Zika infections confirmed in 9 pregnant women in US,https://newsinfo.inquirer.net/769077/cdc-zika-infections-confirmed-in-9-pregnant-women-in-us,... birth to a baby with a rare birth. ... Control and Prevention shows a female Aedes aegypti mosquito in the process of acquiring a blood meal ...
Sotto finds ally in Barbers vs pending passage of RH bill,https://newsinfo.inquirer.net/249939/sotto-finds-ally-in-barbers-vs-pending-passage-of-rh-bill,"... birth control pills. Article continues after this advertisement. Barbers, former governor and congressman of Surigao del Norte, said he and ..."
Pandemic lockdowns linked to decline in US twin births ...,https://newsinfo.inquirer.net/1702474/pandemic-lockdowns-linked-to-decline-in-us-twin-births-study-suggests,"... Control and Prevention suggest ... The largest declines were in November and December of 2020 and January 2021, when twin birth ..."
Malaysia condom maker mixes business and pleasure,https://newsinfo.inquirer.net/377939/malaysia-condom-maker-mixes-business-and-pleasure,"... law in January requiring government health centres to supply free condoms and birth control pills, and mandating sex education in schools."
Filipinos demand right to divorce: 'We want to break free',https://newsinfo.inquirer.net/1777874/filipinos-demand-right-to-divorce-we-want-to-break-free,"A controversial birth control law was passed in 2012, despite strong opposition from the Church. And in 2018, majority and opposition ..."
Catholics protest RH bill,https://newsinfo.inquirer.net/242659/catholics-protest-rh-bill,"The law would use a government health insurance fund to provide birth control pills, condoms and other contraceptives for free. It would ..."
Bebeng (International codename Aere) death toll rises to ...,https://newsinfo.inquirer.net/5938/bebeng-international-codename-aere-death-toll-rises-to-31-in-philippines,... birth control bill with sedi... EDITORS' PICK. BOC seizes P42 million worth of shabu at NAIA from a South African · Hurricane Milton: Fil-Am ...
"A step backward for women, HR activist says of DOH ...",https://newsinfo.inquirer.net/754943/a-step-backward-for-women-hr-activist-says-of-doh-budget-cut,“Congress' slashing of the budget for contraception is a ... contraceptive methods such as condoms.” Article continues after this ...
Bishops tell gov't: No free condoms on Valentine's Day,https://newsinfo.inquirer.net/143445/bishops-tell-gov%E2%80%99t-no-free-condoms-on-valentine%E2%80%99s-day,"... condoms and other forms of artificial contraceptives to Filipino couples during the special occasion ... control, not for sex liberalization. “Let ..."
INQUIRER.net Archives | Page 7627 of 14910,https://newsinfo.inquirer.net/source/inquirer-net/page/7627,"Woman inserts spring in vagina as birth control, still gets pregnant. September 17, 2019. Regions. BI nets 324 Chinese nationals 'involved in illegal ..."
Pacquiao as poster boy for Catholic Church,https://newsinfo.inquirer.net/6870/pacquiao-as-poster-boy-for-catholic-church,... condoms and birth control pills. So why do we still need to pass it when people are already using these?” Hahaha! Article continues after ...
Nakabawos ta batok sa Mexico gahapon,https://newsinfo.inquirer.net/325487/nakabawos-ta-batok-sa-mexico-gahapon,Iyang gikondenar ang paggamit sa magtiayon ug condom og ubang contraceptive method ug artificial birth control nga nakasupak sa kabubut-on sa ...
Philippines welcomes 100 millionth baby,https://newsinfo.inquirer.net/623749/philippines-welcomes-100-millionth-baby,"... law providing the poor with birth control services. Perez said with the law's implementation, about two to three million women who ..."
"Pacquiao stance vs RH bill is anti-poor, says workers' party",https://newsinfo.inquirer.net/6835/pacquiao-stance-vs-rh-bill-is-anti-poor-says-workers%E2%80%99-party,"Survey after survey has shown the majority wanting access to reproductive health, among them birth control which Jinkee has the privilege of ..."
"Rare, but healthy, quintuplets born in US",https://newsinfo.inquirer.net/417049/rare-but-healthy-quintuplets-born-in-us,The Centers for Disease Control and Prevention counted 37 babies ... birth pregnancy. Your subscription could not be saved. Please try ...
Duterte idea takes shape: Rehab center rises in Army camp,https://newsinfo.inquirer.net/817767/duterte-idea-takes-shape-rehab-center-rises-in-army-camp,"Cane, author of the ordinance that gave birth to Sure, said the rehab center would have a dormitory, administration building, toilets and ..."
6 boys barred from joining graduation over 'public kissing,https://newsinfo.inquirer.net/169117/catholic-school-bars-6-boys-from-joining-graduation-over-public-kissing%E2%80%99%E2%80%99,"... birth control. With AFP. READ NEXT. PNP chief orders probe on mall robbery. Tornado topples trees, shatters glass in Bacolod; floods hit C ..."
Reproductive Health Law takes effect,https://newsinfo.inquirer.net/342197/philippine-birth-control-law-takes-effect,"Under the law, government health centers will have to have a supply of contraceptives ... birth control services, she said. READ NEXT. Only 38 of ..."
Church leaders to closely monitor Sona on Monday,https://newsinfo.inquirer.net/29037/church-leaders-to-closely-monitor-sona-on-monday,"The bill also pushes the use of “modern” methods of family planning, including condoms, birth control pills, intrauterine devices and ..."
"Tour agencies offer PH passports, birth certificates to ...",https://newsinfo.inquirer.net/1235888/2-tour-agencies-allegedly-offer-chinese-nationals-ph-passports-birth-certificates-via-wechat-hontiveros,"... Control and Enforcement Unit (TCEU), duty Immigration supervisor, and terminal heads. READ: A P10 billion scheme: Alleged 'pastillas' modus ..."
Marines who killed Abu Sayyaf leader honored,https://newsinfo.inquirer.net/52019/marines-who-killed-abu-sayyaf-leader-honored,"... birth control aid just propaganda, s... EDITORS' PICK. Comelec: Five petitions to cancel candidacy for 2025 polls filed so far · Blinken at ..."
DOH seeking P600-M fund to fight HIV,https://newsinfo.inquirer.net/742856/doh-seeking-p600-m-fund-to-fight-hiv,The Department of Health (DOH) is seeking to double the budget allocation for human immunodeficiency virus (HIV) control and prevention to ...
"Don't trade faith for aid, 'Yolanda' victims urged",https://newsinfo.inquirer.net/618435/dont-trade-faith-for-aid-yolanda-victims-urged,"... birth control services. “This phenomenon is alarming,” he said in the CBCP article. “They violate Catholic norms of morality and many times ..."
INQUIRER.net Archives | Page 7631 of 14914,https://newsinfo.inquirer.net/source/inquirer-net/page/7631,"Woman inserts spring in vagina as birth control, still gets pregnant. September 17, 2019. Regions. BI nets 324 Chinese nationals 'involved in illegal ..."
"Beyond expletives, Duterte 'a man of the poor' - Ateneo de ...",https://newsinfo.inquirer.net/787504/beyond-expletives-duterte-a-man-of-the-poor-says-ateneo-de-davao-president,... birth control methods for families with multiple children. “Buti sana kung magbigay ang Katoliko ng honorarium (to families with multiple ...
"Trump win resets culture war debate on abortion, LGBT rights",https://newsinfo.inquirer.net/843994/trump-win-resets-culture-war-debate-on-abortion-lgbt-rights,"... birth control coverage requirement in the Affordable Care Act. Now, advocates see a transformed landscape. “We now have more equilibrium ..."
Turkey's Erdogan vows social media controls after insults ...,https://newsinfo.inquirer.net/1300382/turkeys-erdogan-vows-social-media-controls-after-insults-to-family,Turkey's president vowed Wednesday to tighten government control ... law when they announced the birth of their fourth child on Twitter.
CBCP: Arroyo welcome to join anti-RH rally,https://newsinfo.inquirer.net/240983/cbcp-arroyo-welcome-to-join-anti-rh-rally,"... birth control methods to use to plan their family sizes. Meanwhile, CBCP president and Cebu Archbishop Jose Palma warned Malacañang against ..."
Kansas attorney general sues to prevent transgender ...,https://newsinfo.inquirer.net/1798948/kansas-attorney-general-sues-to-prevent-transgender-people-from-changing-drivers-licenses,"... birth certificates to reflect their gender identities, Monday, June ... Laura Kelly, and agencies under her control, from letting transgender ..."
"Reformist pope, murdered archbishop to be made saints",https://newsinfo.inquirer.net/974057/reformist-pope-murdered-archbishop-to-be-made-saints,"... birth control pill. “A wise pastor”. Romero, murdered in 1980, was beatified in San Salvador, the capital of El Salvador in Central America ..."
"No mention of RH bill in Sona, says Sotto",https://newsinfo.inquirer.net/234689/no-mention-of-rh-bill-in-sona-says-sotto,"“He did not mention anything about contraceptives, abortion, birth control, and population control, nothing about that. That is what is ..."
Palatino's low blow,https://newsinfo.inquirer.net/216397/palatino%E2%80%99s-low-blow,"The debate cited artificial birth control as no longer a matter of religious belief, but rather a self-determining act that no government or ..."
Aquino to welcome Pacquiao at Palace despite opposing ...,https://newsinfo.inquirer.net/6777/aquino-to-welcome-pacquiao-at-palace-despite-opposing-views-on-rh-bill,... birth control measures and freedom to choose the type of birth control method they would use. The Catholic leaders have reservations on the ...
China: Birth limits still needed despite easing,https://newsinfo.inquirer.net/530659/china-birth-limits-still-needed-despite-easing,“The control of population and keeping a low fertility rate is a ... birth rate is pushing up average age of the population of 1.3 ...
Duman Festival gives birth to EcoPark atop lahar dike,https://newsinfo.inquirer.net/745955/duman-festival-gives-birth-to-ecopark-atop-lahar-dike,"As early as 2010, Mayor Yolanda Pineda led a series of tree-planting activities to control dust. These days, residents seek the shade of ..."
"Fire under control, attention turns to Notre Dame's future",https://newsinfo.inquirer.net/1107305/fire-under-control-attention-turns-to-notre-dames-future,PARIS - Experts are assessing the blackened shell of Paris' iconic Notre Dame cathedral to establish next steps to save what remains after a ...
UK public tribunal to probe Uighur 'genocide' claims,https://newsinfo.inquirer.net/1330925/uk-public-tribunal-to-probe-uighur-genocide-claims,A recent investigation by the AP found that the Chinese government is systematically forcing birth control on Uighurs and other Muslims in an ...
China accuses US at UN of trying to take world back to ' ...,https://newsinfo.inquirer.net/1343181/china-accuses-us-at-un-of-trying-to-take-world-back-to-jungle-age#!,... birth control devices. Article continues after this advertisement. A spokesperson for China's U.N. mission in New York said in a statement ...
Reversal of downward trend: S. Korea reports 26 new ...,https://newsinfo.inquirer.net/1274261/reversal-of-downward-trend-s-korea-reports-26-new-coronavirus-cases,"... birth control, Indonesia set to see a C... 'Ambo' may develop into a ... law · Filing of charges vs Tony Yang takes priority over deportation – ..."
Birth defects seen in 6% of US pregnancies with Zika,https://newsinfo.inquirer.net/853794/birth-defects-seen-in-6-of-us-pregnancies-with-zika,... Control and Prevention shows a female Aedes aegypti mosquito in the process of acquiring a blood meal from a human host. The Zika virus is ...
Cebu Daily News | The latest from Inquirer News,https://newsinfo.inquirer.net/category/cdn/page/1705,"Dog birth control to fight rabies. June 25, 2012. CDN - News. Electric rate increases in Veco, Meralco 'alarming trend' says solon. June 25, 2012. CDN - News ..."
"Hammocks, motorcycles and safe birth",https://newsinfo.inquirer.net/646328/hammocks-motorcycles-and-safe-birth,"The ordinance seeks to reduce infant deaths, which were “quite high” in Tinambac in the past, Velarde said. The municipal health office listed ..."
Cebu Daily News Archives | Page 2745 of 2792,https://newsinfo.inquirer.net/source/cebu-daily-news/page/2745?ModPagespeed=off,"Birth control not the answer. May 29, 2011 BY: Ricky Poca. CDN - Opinion. Making school gender-fair. May 29, 2011 BY: Sofia Logarta. CDN - Visayas. Samar mayor ..."
Virus-infected woman gives birth to baby with no infection,https://newsinfo.inquirer.net/1228352/virus-infected-woman-gives-birth-to-baby-with-no-infection,... control and prevention Tuesday. FEATURED STORIES. NEWSINFO. Bong Go's aide summoned to next House hearing on drug war. NEWSINFO. Palace suspends ...
May 2012 | Page 102 of 329 | Inquirer News,https://newsinfo.inquirer.net/date/2012/05/page/102,"CORONA'S WORDS. May 22, 2012. World. US Catholics file suits over birth control requirement. May 22, 2012. Previous Next. Don't miss out on the latest news and ..."
CHR: Sorsogon City depriving women of artificial ...,https://newsinfo.inquirer.net/843981/chr-sorsogon-city-depriving-women-of-artificial-contraceptives,The Commission on Human Rights (CHR) called out Sorsogon City Mayor Sally Lee for allegedly withholding artificial contraceptives from women ...
Crowded Earth: how many is too many?,https://newsinfo.inquirer.net/81691/crowded-earth-how-many-is-too-many,"... birth control is the key. Geoff Dabelko, director of the Environmental Change and Security Programme at the Woodrow Wilson Center in ..."
Agence France-Presse Archives | Page 2818 of 3119,https://newsinfo.inquirer.net/source/agence-france-presse/page/2818,"... birth control requirement. May 22, 2012. World. Malaysia's Anwar charged, alleges new persecution. May 22, 2012 BY: M. Jegathesan. Previous Next. Don't miss out ..."
"It's Aquino's duty to push RH bill, says ally",https://newsinfo.inquirer.net/316905/its-aquinos-duty-to-push-rh-bill-says-ally,"... birth control methods, and bans contraceptives that prevent the implantation of a fertilized ovum, as this is considered abortion by some ..."
Church won't argue with other religious groups backing RH ...,https://newsinfo.inquirer.net/4129/church-won%E2%80%99t-argue-with-other-religious-groups-backing-rh-bill,"Several church denominations, including the influential Iglesia Ni Cristo have thrown their support for artificial birth control methods and ..."
Pacquiao Church poster boy vs RH bill,https://newsinfo.inquirer.net/6622/pacquiao-church-poster-boy-vs-rh-bill,... condoms or [birth pills]. So why do we still need to pass it when ... birth control methods. Pacquiao is the third child in a brood of ...
Customers cheer after woman gives birth at Missouri Walmart,https://newsinfo.inquirer.net/1248997/customers-cheer-after-woman-gives-birth-at-missouri-walmart,Customers cheered at a Walmart in Missouri after a woman gave birth to a baby girl in the store's toilet paper aisle ... control making sure that ...
'Human rights crisis': UN says half of global pregnancies ...,https://newsinfo.inquirer.net/1575792/human-rights-crisis-un-says-half-of-global-pregnancies-unintended,... contraception and abortion robbed women of “the most life-altering ... contraceptive supplies”. The UNFPA report was built on new data ...
"Pope makes El Salvador's Oscar Romero, Pope Paul VI ...",https://newsinfo.inquirer.net/1042666/pope-makes-el-salvadors-oscar-romero-pope-paul-vi-saints,"... contraception like birth control pills or condoms empowered conservatives but drove progressives away. Even today, studies show that most ..."
4 mild quakes hit Visayas,https://newsinfo.inquirer.net/148215/4-mild-quakes-hit-visayas,"... birth control bill. Suspected NPA leader captured in Catanduanes. EDITORS' PICK. Eya Laure on her way out of Chery Tiggo; EJ, Duremdes also ..."
PAOCC: Woman linked to Porac Pogo may also be Chinese,https://newsinfo.inquirer.net/1964479/paocc-woman-linked-to-porac-pogo-may-also-be-a-chinese-national,"“Katherine Cassandra Li Ong is Chinese, her father is Richard Ong Chao, and then another birth certificate of his father shows that he is ..."
When does life begin? 3 justices leave it to experts,https://newsinfo.inquirer.net/594068/when-does-life-begin-3-justices-leave-it-to-experts,"That was why they had wanted the high court to stop the implementation of the RH law, arguing that hormonal contraceptives or birth control ..."
Canadian forest fire still burning out of control,https://newsinfo.inquirer.net/785220/canadian-forest-fire-still-burning-out-of-control#!,"I agree to the Terms of Use and acknowledge that I have read the Privacy Policy. READ NEXT. When Zika hits, a push for birth control and ..."
BI nets 324 Chinese nationals 'involved in illegal activities' ...,https://newsinfo.inquirer.net/1165605/bi-nets-324-chinese-nationals-involved-in-illegal-activities-in-palawan,I agree to the Terms of Use and acknowledge that I have read the Privacy Policy. READ NEXT. Woman inserts spring in vagina as birth control ...
World | The latest from Inquirer News,https://newsinfo.inquirer.net/category/latest-stories/world-latest-stories/page/4248,"Woman inserts spring in vagina as birth control, still gets pregnant. September 17, 2019. World. Palestinian sues Israeli military commanders for war crimes."
Pregnancy and women's health | Inquirer News,https://newsinfo.inquirer.net/6298/pregnancy-and-women%E2%80%99s-health,"... control have a higher risk of neural tube defects as well as other birth defects, including cleft palate, cleft lip septal anomalies ..."
Pandemic hardly curbed 'risky behaviors' leading to HIV ...,https://newsinfo.inquirer.net/1700353/pandemic-hardly-curbed-risky-behaviors-leading-to-hiv-cases,The COVID-19 pandemic stalled efforts to control the spread of the ... Those behaviors include unprotected sex or nonuse of condoms ...
Pangasinan family: 2+21 -5+5+48 and counting,https://newsinfo.inquirer.net/25579/pangasinan-family-221-5548-and-counting,"... birth control method to tying a string around a finger and pulling it tight till it causes pain and swelling. This kind of thinking, Rivera ..."
Romney vows 'new conservative era' if elected,https://newsinfo.inquirer.net/143825/romney-vows-new-conservative-era-if-elected,CPAC comes amid a political spat over an Obama plan to require most insurance policies to cover birth control for women. The proposed rule ...
June 10 is 'Danding Cojuangco Day' in Tarlac | Inquirer News,https://newsinfo.inquirer.net/1444525/june-10-is-danding-cojuangco-day-in-tarlac,"The declaration of the special day, which is Cojuangco's birth ... Provincial Ordinance No. 004-2021, which was authored by Vice Gov ..."
Opponents worry over P-Noy's support for RH bill,https://newsinfo.inquirer.net/241997/opponents-worry-over-p-noys-support-for-rh-bill,"If his parents had practiced birth control, Rama said he would not have been born. Bullecer warned that Malacanang would use its influence ..."
Puerto Rico declares first case of Zika-related microcephaly,https://newsinfo.inquirer.net/785587/puerto-rico-declares-first-case-of-zika-related-microcephaly,"Puerto Rico said it has counted 925 cases of Zika so far, 18 of which involve pregnant women. READ: When Zika hits, a push for birth control ..."
December 2012 | Page 116 of 295 | Inquirer News,https://newsinfo.inquirer.net/date/2012/12/page/116,"Philippine birth control fight not over—bishops. December 18, 2012. Nation. Lawmakers, senators hold pre-bicam meeting. December 18, 2012 BY: Maila Ager."
Population growth slows as contraceptive use spikes,https://newsinfo.inquirer.net/787554/population-growth-slows-as-contraceptive-use-spikes,"PopCom said that 16 percent of women were already using contraception to delay their next birth while 39 percent, to stop childbearing. The ..."
Taguig City offers residents online medical consultation ...,https://newsinfo.inquirer.net/1249462/taguig-city-offers-residents-online-medical-consultation-during-luzon-quarantine,... birth control pills. /MUF. Your subscription could not be saved. Please try again. Your subscription has been successful. Subscribe to our ...
Chemical spill in Batangas under control – OCD,https://newsinfo.inquirer.net/1856408/chemical-spill-in-batangas-under-control-ocd,"Chemical spill in Batangas under control – OCD · Birth records of 1,733 foreigners faked, says PSA · POC says all athletes invited after PH ..."
Philip C. Tubeza Archives | Page 139 of 141 | Inquirer News,https://newsinfo.inquirer.net/byline/philip-c-tubeza/page/139,"Bishops urged to use charm in fight against birth control. April 23, 2011 BY: Philip C. Tubeza. Headlines. 'Only non-wage benefits on Labor Day'. April 19, 2011 ..."
Controversial Rody gives yet another preview of his style,https://newsinfo.inquirer.net/787370/controversial-rody-gives-yet-another-preview-of-his-style,"... birth control methods, including the use of condoms, which the Catholic Church disapproves of. A national population policy must be put in ..."
Why can't the Church forgive Celdran?,https://newsinfo.inquirer.net/663681/why-cant-the-church-forgive-celdran,... birth control method that suited them. Celdran was just exercising his right to free expression which the Constitution provides. But alas ...
