Title,Link,Snippet
US watchdog to investigate whistleblower's detention ...,https://newsinfo.inquirer.net/1335920/us-watchdog-to-investigate-whistleblowers-detention-allegations,Wooten told Reuters on Monday that women who complained of heavy periods or asked for birth control would be sent to outside gynecologists ...
"Your body, your choice: Why is bodily autonomy so ...",https://newsinfo.inquirer.net/1434418/explainer-your-body-your-choice-why-is-bodily-autonomy-so-important,"... contraceptive services including the use of emergency contraception. The Philippines had a perfect record on sex education, according to ..."
DOH braces for more women giving birth in hospitals,https://newsinfo.inquirer.net/1751346/doh-braces-for-more-women-giving-birth-in-hospitals,Diego Danilo Jr. of the DOH disease prevention and control bureau said the trend of pregnant women accessing public maternal care services was ...
Trump to sign order on political limits for churches,https://newsinfo.inquirer.net/894285/trump-to-sign-order-on-political-limits-for-churches,"Those requirements include covering birth control and the move could apply to religious groups like the Little Sisters of the Poor, who have ..."
Over 320000 used condoms being sold as new seized by ...,https://newsinfo.inquirer.net/1340468/over-320000-used-condoms-being-sold-as-new-seized-by-police,"... condoms poses a health risk and can lead to infections, according to the Centers for Disease Control and Prevention. Ryan Arcadio /ra."
Associated Press Archives | Page 2701 of 3057,https://newsinfo.inquirer.net/source/associated-press/page/2701,"Dog birth control shots could limit populations. June 22, 2013. World. US Justice Dept: Complaint filed against Snowden. June 22, 2013. World. Calgary flooding ..."
Pacquiao team steps up delivery of typhoon aid that even ...,https://newsinfo.inquirer.net/1530928/pacquiao-team-steps-up-delivery-of-typhoon-aid-that-even-pets-get-relief,... Birth Control and had asked his office to deliver them to Siargao island. Article continues after this advertisement. Aside from pet food ...
Ricky Poca Archives | Page 29 of 29 | Inquirer News,https://newsinfo.inquirer.net/byline/ricky-poca/page/29,"Birth control not the answer. May 29, 2011 BY: Ricky Poca. CDN - Opinion. Right to demolish. May 24, 2011 BY: Ricky Poca. CDN - Opinion. Move squatters to SRP ..."
Case of P1-B cut on RH funds may reach SC,https://newsinfo.inquirer.net/755565/case-of-p1-b-cut-on-rh-funds-may-reach-sc,"... condoms, intrauterine devices, and birth control pills. FEATURED ... Condoms have been widely used as protection against the virus that ..."
Marcos commends Enrile on 100th birth anniversary,https://newsinfo.inquirer.net/1904368/fwd-marcos-on-enrile,President Ferdinand “Bongbong” R. Marcos Jr. greeted the newly minted centenarian Juan Ponce Enrile on his birthday.
DOH to start giving out condoms in schools next year,https://newsinfo.inquirer.net/849926/doh-to-start-giving-out-condoms-in-schools-next-year,"Starting next year, the Department of Health (DOH) plans to distribute condoms in schools as part of its “business unusual” strategy amid the sharp rise in the ..."
It's safe to give birth in hospitals amid COVID-19 crisis ...,https://newsinfo.inquirer.net/1256671/doh-assures-pregnant-women-its-safe-to-give-birth-in-hospitals-amid-covid-19-crisis,The agency stressed that hospitals are following strict infection prevention and control measures against COVID-19. “Huwag tayong mangamba ...
"Sorry, gays, Duterte is no longer for same-sex union",https://newsinfo.inquirer.net/882749/sorry-gays-duterte-is-no-longer-for-same-sex-union,"Aggressive birth control. It was at this point that he segued into birth control, calling the Church a “problem.” “The Philippines is ..."
"51 contraceptives, including Implanon, can't cause abortion",https://newsinfo.inquirer.net/944873/contraceptive-implanon-abortion-non-abortifacient-rh-law-reproductive-health-tro-fda,... contraceptive is inserted under the skin of a woman's arm to control her fertility for three years. —JUNJIE MENDOZA/CEBU DAILYNEWS. The 51 ...
Venezuela crisis pushes women into 'forced motherhood',https://newsinfo.inquirer.net/1155807/venezuela-crisis-pushes-women-into-forced-motherhood,The extent of Venezuela's birth control shortage and the impact on women is difficult to quantify in part because the government has not ...
"Numbers fall but PH teen pregnancies persist, mirror ...",https://newsinfo.inquirer.net/1723038/numbers-fall-but-ph-teen-pregnancies-persist-mirror-economic-learning-gaps,"... pregnancy rates among ASEAN member states, with over 500 teens becoming pregnant and giving birth every day. Article continues after this ..."
Metro | The latest from Inquirer News,https://newsinfo.inquirer.net/category/inquirer-headlines/metro/page/2161,"Muntinlupa mayor: Contraceptive ordinance dead. June 30, 2011 BY: Tina G. Santos. Headlines. Kenyan, Filipina caught with P24M shabu. June 30, 2011 BY: DJ Yap."
Tagum: A poster city for RH bill,https://newsinfo.inquirer.net/14082/tagum-a-poster-city-for-rh-bill,"As national debate rages over the reproductive health (RH) bill, Tagum City has been sponsoring birth control methods for the past six ..."
Photos & Videos | The latest from Inquirer News,https://newsinfo.inquirer.net/category/photos-videos/page/278,"Urban poor women welcome birth control victory. April 09, 2014. Featured Gallery. Australian ship detects two more signals in plane hunt – official. April 09 ..."
Hard facts vs hardened wills,https://newsinfo.inquirer.net/37073/hard-facts-vs-hardened-wills,"Do birth control pills and the IUD kill the embryo? Yes, the pill has a secondary “postfertilization effect,” according to the scientific ..."
RH law advocates mount last ditch campaign for measure,https://newsinfo.inquirer.net/590019/rh-law-advocates-mount-last-ditch-campaign-for-measure,"The RH law mandates the promotion of all forms of birth control, including artificial contraception, in government health programs and the ..."
German rabbit breeders hit pope's sex comments,https://newsinfo.inquirer.net/666956/german-rabbit-breeders-hit-popes-sex-comments,Pope Francis said Monday that Catholics should instead practice “responsible parenting” and use Church-approved forms of birth control.
"Fear, pain, despair: Breaking silence on endometriosis 'hell'",https://newsinfo.inquirer.net/1444349/fear-pain-despair-breaking-silence-on-endometriosis-hell,... birth control pills and surgery — is a question of trial and error. Article continues after this advertisement. Despite affecting nearly 200 ...
How about a vasectomy? Uganda wants more men to say ...,https://newsinfo.inquirer.net/942717/how-about-a-vasectomy-uganda-wants-more-men-to-say-yes-vasectomy-uganda-world-news-family-planning,"The issue is widespread in Africa, which faces a population boom even as other parts of the world see dropping birth rates. ... birth control. “If ..."
"How first-time mothers are giving birth, rearing babies in ...",https://newsinfo.inquirer.net/1336747/how-first-time-mothers-are-giving-birth-rearing-babies-in-the-new-normal,"... birth control and family planning methods have been affected and decreased. In the Philippines, the Commission on Population and Development ..."
School principals get 'hands on' experience with condoms,https://newsinfo.inquirer.net/319643/school-principals-get-hands-on-experience-with-condoms,... condoms—some for the very first time—and interacting with people ... Control Policy in the Workplace Program. Article continues after ...
World | The latest from Inquirer News,https://newsinfo.inquirer.net/category/world-latest-stories/page/3671,"World · With limited access to birth control, Indonesia set to see a COVID-19 baby boom · Reversal of downward trend: S. · New Wuhan coronavirus infections show ' ..."
"Family planning not for Muslims, says Turkey's Erdogan",https://newsinfo.inquirer.net/788328/family-planning-not-for-muslims-says-turkeys-erdogan,"ISTANBUL, Turkey — Turkish President Recep Tayyip Erdogan said on Monday that family planning and contraception ... “People talk about birth ..."
Barrio doctor Juan Flavier was Senate's resident funnyman,https://newsinfo.inquirer.net/648270/barrio-doctor-juan-flavier-was-senates-resident-funnyman,"Even in the face of adversity, his humor got the better of him. While rebuked for promoting birth control and condom use to fight the dreaded ..."
Pacquiao 'trying hard' to spar with Lagman on RH,https://newsinfo.inquirer.net/6918/pacquiao-%E2%80%98trying-hard%E2%80%99-to-spar-with-lagman-on-rh,"... condoms or birth control pills. Welcome to call. Ramos cited other strongly Catholic countries, like Italy, which, he claimed, progresses ..."
Can scientists prove Zika virus is causing birth defects?,https://newsinfo.inquirer.net/766516/can-scientists-prove-zika-virus-is-causing-birth-defects,"... control study, which looks back in time after an illness or condition has occurred. For the birth defect research, that means recruiting a ..."
Associated Press Archives | Page 2626 of 3057,https://newsinfo.inquirer.net/source/-associated-press/page/2626,"... birth control. November 01, 2013. Previous Next. Don't miss out on the latest news and information. Follow us: like-us · follow-us. TRENDING ..."
QC jail inmates given condoms to curb HIV,https://newsinfo.inquirer.net/881700/qc-jail-inmates-given-condoms-to-curb-hiv,"This is our conundrum,” Latoza said, referring to the AIDS Prevention and Control Act of 1998. Article continues after this advertisement."
Bishops say gays have gifts to offer church,https://newsinfo.inquirer.net/644661/bishops-say-gays-have-gifts-to-offer-church,"The tone of the report on a host of hot-button family issues such as marriage, divorce, homosexuality and birth control was one of almost- ..."
UP students give out condoms at church on Valentine's Day,https://newsinfo.inquirer.net/764703/up-students-give-out-condoms-at-church-on-valentines-day,Student activists celebrated Valentine's Day by handing out condoms in front of the Baguio Cathedral on Sunday (Feb. 14) ... control the effects of ...
"Join 'Iglesia ni Duterte,' Digong says after spat with clergy",https://newsinfo.inquirer.net/787315/join-iglesia-ni-duterte-digong-tells-filipinos-amid-word-war-with-clergy,... birth control methods to the people. Article continues after this advertisement. READ: Duterte defies Catholic Church's belief on family ...
PopCom raises alarm over children as young as 10 getting ...,https://newsinfo.inquirer.net/1724656/popcom-expresses-concern-about-teen-pregnancies-even-as-early-as-10-to-14-years-old,"... birth in 2020, but this figure dipped to 2,299 in 2021. Article ... “Without a written parental consent, no minor can access modern contraception ..."
RH Bill finally signed into law,https://newsinfo.inquirer.net/331395/gonzales-aquino-signed-rh-bill-into-law,The law will only provide minors with access to artificial birth control methods in health centers and state-run hospitals if they have ...
CDN - Opinion | The latest from Inquirer News,https://newsinfo.inquirer.net/category/cdn/cdn-opinion/page/435,"Birth control not the answer. May 29, 2011 BY: Ricky Poca. CDN - Opinion ... law for 8 new trial courts. 2024-10-14 04:50:32. The Inquirer Channels. News ..."
What happened to Catholic vote?,https://newsinfo.inquirer.net/409411/what-happened-to-catholic-vote,"... birth control methods, including the use of condoms and other contraceptives. Article continues after this advertisement. 'Team Buhay ..."
Teen pregnancies could rise during pandemic – Popcom,https://newsinfo.inquirer.net/1394522/popcom-covid-curbs-could-worsen-teen-pregnancies,"One of the girls gave birth in Metro Manila and the other in Calabarzon (Cavite, Laguna, Batangas, Rizal and Quezon), the two regions with the ..."
World | The latest from Inquirer News,https://newsinfo.inquirer.net/category/latest-stories/world-latest-stories/page/6340,"When Zika hits, a push for birth control and abortion? May 12, 2016. World. Canadian forest fire still burning out of control. May 12, 2016. World. Man who ..."
QC hospitals may soon be required to register all births,https://newsinfo.inquirer.net/538949/qc-hospitals-may-soon-be-required-to-register-all-births,"The ordinance, authored by fourth district councilor Jessica Castelo-Daza, requiring the registration within 30 days of birth has been ..."
June 2013 | Page 79 of 290 | Inquirer News,https://newsinfo.inquirer.net/date/2013/06/page/79,"Dog birth control shots could limit populations. June 22, 2013. Regions. Food poisoning downs 8 soldiers in Davao del Sur. June 22, 2013 BY: Orlando Dinoy."
"Take RH bill protest to the streets, bishops urge faithful",https://newsinfo.inquirer.net/238069/take-rh-bill-protest-to-the-streets-bishops-urge-faithful,"... birth control methods and reproductive health information to Filipinos. The bill, which has spurred a culture war between the Church and ..."
"Reformist pope, murdered archbishop to be made saints",https://newsinfo.inquirer.net/974057/reformist-pope-murdered-archbishop-to-be-made-saints,"... birth control pill. “A wise pastor”. Romero, murdered in 1980, was beatified in San Salvador, the capital of El Salvador in Central America ..."
"No mention of RH bill in Sona, says Sotto",https://newsinfo.inquirer.net/234689/no-mention-of-rh-bill-in-sona-says-sotto,"“He did not mention anything about contraceptives, abortion, birth control, and population control, nothing about that. That is what is ..."
Palatino's low blow,https://newsinfo.inquirer.net/216397/palatino%E2%80%99s-low-blow,"The debate cited artificial birth control as no longer a matter of religious belief, but rather a self-determining act that no government or ..."
Aquino to welcome Pacquiao at Palace despite opposing ...,https://newsinfo.inquirer.net/6777/aquino-to-welcome-pacquiao-at-palace-despite-opposing-views-on-rh-bill,... birth control measures and freedom to choose the type of birth control method they would use. The Catholic leaders have reservations on the ...
China: Birth limits still needed despite easing,https://newsinfo.inquirer.net/530659/china-birth-limits-still-needed-despite-easing,“The control of population and keeping a low fertility rate is a ... birth rate is pushing up average age of the population of 1.3 ...
Duman Festival gives birth to EcoPark atop lahar dike,https://newsinfo.inquirer.net/745955/duman-festival-gives-birth-to-ecopark-atop-lahar-dike,"As early as 2010, Mayor Yolanda Pineda led a series of tree-planting activities to control dust. These days, residents seek the shade of ..."
"Fire under control, attention turns to Notre Dame's future",https://newsinfo.inquirer.net/1107305/fire-under-control-attention-turns-to-notre-dames-future,PARIS - Experts are assessing the blackened shell of Paris' iconic Notre Dame cathedral to establish next steps to save what remains after a ...
UK public tribunal to probe Uighur 'genocide' claims,https://newsinfo.inquirer.net/1330925/uk-public-tribunal-to-probe-uighur-genocide-claims,A recent investigation by the AP found that the Chinese government is systematically forcing birth control on Uighurs and other Muslims in an ...
China accuses US at UN of trying to take world back to ' ...,https://newsinfo.inquirer.net/1343181/china-accuses-us-at-un-of-trying-to-take-world-back-to-jungle-age#!,... birth control devices. Article continues after this advertisement. A spokesperson for China's U.N. mission in New York said in a statement ...
Reversal of downward trend: S. Korea reports 26 new ...,https://newsinfo.inquirer.net/1274261/reversal-of-downward-trend-s-korea-reports-26-new-coronavirus-cases,"... birth control, Indonesia set to see a C... 'Ambo' may develop into a ... law · Filing of charges vs Tony Yang takes priority over deportation – ..."
Birth defects seen in 6% of US pregnancies with Zika,https://newsinfo.inquirer.net/853794/birth-defects-seen-in-6-of-us-pregnancies-with-zika,... Control and Prevention shows a female Aedes aegypti mosquito in the process of acquiring a blood meal from a human host. The Zika virus is ...
Cebu Daily News | The latest from Inquirer News,https://newsinfo.inquirer.net/category/cdn/page/1705,"Dog birth control to fight rabies. June 25, 2012. CDN - News. Electric rate increases in Veco, Meralco 'alarming trend' says solon. June 25, 2012. CDN - News ..."
"Hammocks, motorcycles and safe birth",https://newsinfo.inquirer.net/646328/hammocks-motorcycles-and-safe-birth,"The ordinance seeks to reduce infant deaths, which were “quite high” in Tinambac in the past, Velarde said. The municipal health office listed ..."
Cebu Daily News Archives | Page 2745 of 2792,https://newsinfo.inquirer.net/source/cebu-daily-news/page/2745?ModPagespeed=off,"Birth control not the answer. May 29, 2011 BY: Ricky Poca. CDN - Opinion. Making school gender-fair. May 29, 2011 BY: Sofia Logarta. CDN - Visayas. Samar mayor ..."
Virus-infected woman gives birth to baby with no infection,https://newsinfo.inquirer.net/1228352/virus-infected-woman-gives-birth-to-baby-with-no-infection,... control and prevention Tuesday. FEATURED STORIES. NEWSINFO. Bong Go's aide summoned to next House hearing on drug war. NEWSINFO. Palace suspends ...
May 2012 | Page 102 of 329 | Inquirer News,https://newsinfo.inquirer.net/date/2012/05/page/102,"CORONA'S WORDS. May 22, 2012. World. US Catholics file suits over birth control requirement. May 22, 2012. Previous Next. Don't miss out on the latest news and ..."
CHR: Sorsogon City depriving women of artificial ...,https://newsinfo.inquirer.net/843981/chr-sorsogon-city-depriving-women-of-artificial-contraceptives,The Commission on Human Rights (CHR) called out Sorsogon City Mayor Sally Lee for allegedly withholding artificial contraceptives from women ...
Crowded Earth: how many is too many?,https://newsinfo.inquirer.net/81691/crowded-earth-how-many-is-too-many,"... birth control is the key. Geoff Dabelko, director of the Environmental Change and Security Programme at the Woodrow Wilson Center in ..."
Agence France-Presse Archives | Page 2818 of 3119,https://newsinfo.inquirer.net/source/agence-france-presse/page/2818,"... birth control requirement. May 22, 2012. World. Malaysia's Anwar charged, alleges new persecution. May 22, 2012 BY: M. Jegathesan. Previous Next. Don't miss out ..."
"It's Aquino's duty to push RH bill, says ally",https://newsinfo.inquirer.net/316905/its-aquinos-duty-to-push-rh-bill-says-ally,"... birth control methods, and bans contraceptives that prevent the implantation of a fertilized ovum, as this is considered abortion by some ..."
Church won't argue with other religious groups backing RH ...,https://newsinfo.inquirer.net/4129/church-won%E2%80%99t-argue-with-other-religious-groups-backing-rh-bill,"Several church denominations, including the influential Iglesia Ni Cristo have thrown their support for artificial birth control methods and ..."
Pacquiao Church poster boy vs RH bill,https://newsinfo.inquirer.net/6622/pacquiao-church-poster-boy-vs-rh-bill,... condoms or [birth pills]. So why do we still need to pass it when ... birth control methods. Pacquiao is the third child in a brood of ...
Customers cheer after woman gives birth at Missouri Walmart,https://newsinfo.inquirer.net/1248997/customers-cheer-after-woman-gives-birth-at-missouri-walmart,Customers cheered at a Walmart in Missouri after a woman gave birth to a baby girl in the store's toilet paper aisle ... control making sure that ...
'Human rights crisis': UN says half of global pregnancies ...,https://newsinfo.inquirer.net/1575792/human-rights-crisis-un-says-half-of-global-pregnancies-unintended,... contraception and abortion robbed women of “the most life-altering ... contraceptive supplies”. The UNFPA report was built on new data ...
"Pope makes El Salvador's Oscar Romero, Pope Paul VI ...",https://newsinfo.inquirer.net/1042666/pope-makes-el-salvadors-oscar-romero-pope-paul-vi-saints,"... contraception like birth control pills or condoms empowered conservatives but drove progressives away. Even today, studies show that most ..."
4 mild quakes hit Visayas,https://newsinfo.inquirer.net/148215/4-mild-quakes-hit-visayas,"... birth control bill. Suspected NPA leader captured in Catanduanes. EDITORS' PICK. Eya Laure on her way out of Chery Tiggo; EJ, Duremdes also ..."
PAOCC: Woman linked to Porac Pogo may also be Chinese,https://newsinfo.inquirer.net/1964479/paocc-woman-linked-to-porac-pogo-may-also-be-a-chinese-national,"“Katherine Cassandra Li Ong is Chinese, her father is Richard Ong Chao, and then another birth certificate of his father shows that he is ..."
When does life begin? 3 justices leave it to experts,https://newsinfo.inquirer.net/594068/when-does-life-begin-3-justices-leave-it-to-experts,"That was why they had wanted the high court to stop the implementation of the RH law, arguing that hormonal contraceptives or birth control ..."
Canadian forest fire still burning out of control,https://newsinfo.inquirer.net/785220/canadian-forest-fire-still-burning-out-of-control#!,"I agree to the Terms of Use and acknowledge that I have read the Privacy Policy. READ NEXT. When Zika hits, a push for birth control and ..."
BI nets 324 Chinese nationals 'involved in illegal activities' ...,https://newsinfo.inquirer.net/1165605/bi-nets-324-chinese-nationals-involved-in-illegal-activities-in-palawan,I agree to the Terms of Use and acknowledge that I have read the Privacy Policy. READ NEXT. Woman inserts spring in vagina as birth control ...
Tatad: RH law is genocide,https://newsinfo.inquirer.net/441563/tatad-rh-law-is-genocide,"MANILA, Philippines—Genocide is any act that prevents birth such as Republic Act (RA) No. ... “They must practice birth control or else suffer the ..."
New York appoints first-ever rat 'czar',https://newsinfo.inquirer.net/1755963/new-york-appoints-first-ever-rat-czar,"... birth control to vermin-proof trash cans. During a stomach-turning presentation in 2019, Adams, then Brooklyn borough president, unveiled a ..."
Widely used diabetes drug linked to birth defects risk—study,https://newsinfo.inquirer.net/1575000/widely-used-diabetes-drug-linked-to-birth-defects-risk-study,"... control of their diabetes, which could also be linked to a higher risk of birth defects. The study showed that the risk for babies born to ..."
US authorizes first condom for use in anal sex,https://newsinfo.inquirer.net/1559153/us-authorizes-first-condom-for-use-in-anal-sex,Although people already use condoms for anal sex — as is recommended by health agencies including the Centers for Disease Control and Prevention ...
Tina G. Santos Archives | Page 294 of 302 | Inquirer News,https://newsinfo.inquirer.net/byline/tina-g.-santos/page/294,"Smoke at your own risk; ban on smoking in public starts Friday. June 30, 2011 BY: Tina G. Santos. Metro. Muntinlupa mayor: Contraceptive ordinance dead. June 30 ..."
Philippine Church 'right' despite Pope Francis comments,https://newsinfo.inquirer.net/494061/philippine-church-right-despite-pope-francis-comments,Philippine Church leaders have led a decade-long campaign against a birth control law that required the state to hand out free condoms and birth ...
Legacy Stories | Inquirer News,https://newsinfo.inquirer.net/legacy-stories/page/15,... law victims want reparations board to quit · Inquirerseven deadliest storms since the 1970s · Muntinlupa mayor contraceptive ordinance dead ...
Cut in DOH budget affects access to reproductive health ...,https://newsinfo.inquirer.net/1245992/cut-in-doh-budget-affects-access-to-reproductive-health-services,A cut in the budget of the DOH intended for purchase of a new type of contraceptive could mean lesser access for women to reproductive ...
Catholic Church: Shun pro-choice candidates,https://newsinfo.inquirer.net/390351/catholic-church-shun-pro-choice-candidates,The law requires state health centres to hand out free condoms and birth control pills and mandates that sex education be taught in schools.
Solons ask DOH to have separate funding for RH in 2024 ...,https://newsinfo.inquirer.net/1827773/solons-ask-doh-to-have-separate-funding-for-rh-in-2024-budget,"Aside from modern contraception methods like pills, injectable and implant contraception, intrauterine devices, condoms and sterilization ..."
Tina G. Santos Archives | Page 294 of 302 | Inquirer News,https://newsinfo.inquirer.net/byline/tina-g-santos/page/294,"... Contraceptive ordinance dead. June 30, 2011 BY: Tina G. Santos. Featured Gallery. Webbs: Stop lies, lunacy. June 30, 2011 BY: Tina G. Santos. Previous Next. Don ..."
Cynthia Villar floats 'population control' for stray animals,https://newsinfo.inquirer.net/1940864/cynthia-villar-floats-population-control-for-stray-animals,"(You know, our problem, we have many poor people, and then their dogs and cats give birth to many. It's said that a cat is capable of ..."
Pacquiao slips RH advocates' jab on Jinkee's pill use,https://newsinfo.inquirer.net/6587/pacquiao-slips-rh-advocates-jab-on-jinkees-pill-use,"... birth control pills, the Saranggani lawmaker replied: “You know, in reality, even if the RH (reproductive health) bill has not yet been ..."
US Supreme Court favors Catholic college in contraception ...,https://newsinfo.inquirer.net/677906/us-supreme-court-favors-catholic-college-in-contraception-case,... contraception for employees on religious grounds ... birth control. FEATURED STORIES. NEWSINFO. Garma: Duterte rewarded cops ...
