Title,Link,Snippet
WHO says delaying pregnancy option for women in Zika ...,https://newsinfo.inquirer.net/789999/who-says-delaying-pregnancy-option-for-women-in-zika-areas,And the US Centers for Disease Control and Prevention has additional advice for non-pregnant travelers: Women should wait at least eight weeks ...
Sen. Vicente Sotto III wants lobbyists for reproductive ...,https://newsinfo.inquirer.net/47377/sen-vicente-sotto-iii-wants-lobbyists-for-reproductive-health-bill-known,"Eugenics refers to the ideology promoting selective breeding, thereby denying birth for the weak and the useless. Among its chief proponents, ..."
Obama seeks upper hand on social issues,https://newsinfo.inquirer.net/284504/obama-seeks-upper-hand-on-social-issues,"... birth control and safe abortions. The US Supreme Court famously upheld a woman's right to an abortion in the 1973 “Roe v Wade” case, which ..."
Philippines' 'Vatican' shows force against RH Bill,https://newsinfo.inquirer.net/61047/philippines%E2%80%99-%E2%80%98vatican%E2%80%99-shows-force-against-rh-bill,"“Contraception changes the way people think about sex ... A 'contraceptive society' creates promiscuity and sexual liberation,” Laws added."
"Davao ordinance ensures safety of moms, kids",https://newsinfo.inquirer.net/826661/davao-ordinance-ensures-safety-of-moms-kids,"... birth attendants.” FEATURED STORIES. NEWSINFO. LPA may form or enter PAR by weekend, says Pagasa. NEWSINFO. Former Roque co-worker asks SC to ..."
Catholic Church in US readies prayer for unborn child,https://newsinfo.inquirer.net/172085/catholic-church-in-us-readies-prayer-for-unborn-child,"... contraceptives, clashing most recently with the Barack Obama administration over whether birth control pills should be covered by health ..."
'Fighting' Sotto breaks down during RH debate,https://newsinfo.inquirer.net/249349/fighting-sotto-breaks-down-during-rh-debate,"... birth. PHOTO BY JOSEPH VIDAL. MANILA, Philippines—From fighting ... birth control pills. FEATURED STORIES. NEWSINFO. Palace suspends gov't ..."
"Lack of trainers, poor LGU support stall RH drive",https://newsinfo.inquirer.net/1157243/lack-of-trainers-poor-lgu-support-stall-rh-drive,"... contraceptive methods, panelists and health workers said during a ... contraception, asked one. “Try the PopCom Family Wellness clinic ..."
'Only Jaime Cardinal Sin can answer like ...,https://newsinfo.inquirer.net/51067/%E2%80%98only-jaime-cardinal-sin-can-answer-like-cardinal-sin%E2%80%99,"... birth control and Charter change. He died of kidney complications on June 21, 2005, at age 76. The 1986 Edsa People Power Revolution, in ..."
Expect long RH debate in Senate—Enrile,https://newsinfo.inquirer.net/262912/expect-long-rh-debate-in-senate-enrile,He has argued consistently that artificial methods of pregnancy prevention such as condoms and IUDs do not deal with any life-threatening ...
Philippines welcomes 7 billionth baby Danica,https://newsinfo.inquirer.net/86183/philippines-welcomes-7-billionth-baby-danica,"... birth control to infant mortality rates. Overwhelmed father. Danica's father, overwhelmed by the attention and the gifts his newborn child ..."
Sen. Lapid takes floor against RH bill,https://newsinfo.inquirer.net/70377/sen-lapid-takes-floor-against-rh-bill,"Lapid, during his interpellation revealed that he had lost a child and traced the child's death to his wife's use of an artificial birth control ..."
"US health care law works in some ways, comes up short in ...",https://newsinfo.inquirer.net/883743/us-health-care-law-works-in-some-ways-comes-up-short-in-others,"The benefits are considered especially important for women, since birth control and other routine services are now covered as preventive care, ..."
CDC: Zika infections confirmed in 9 pregnant women in US,https://newsinfo.inquirer.net/769077/cdc-zika-infections-confirmed-in-9-pregnant-women-in-us,... birth to a baby with a rare birth. ... Control and Prevention shows a female Aedes aegypti mosquito in the process of acquiring a blood meal ...
Pandemic lockdowns linked to decline in US twin births ...,https://newsinfo.inquirer.net/1702474/pandemic-lockdowns-linked-to-decline-in-us-twin-births-study-suggests,"... Control and Prevention suggest ... The largest declines were in November and December of 2020 and January 2021, when twin birth ..."
Malaysia condom maker mixes business and pleasure,https://newsinfo.inquirer.net/377939/malaysia-condom-maker-mixes-business-and-pleasure,"... law in January requiring government health centres to supply free condoms and birth control pills, and mandating sex education in schools."
Catholics protest RH bill,https://newsinfo.inquirer.net/242659/catholics-protest-rh-bill,"The law would use a government health insurance fund to provide birth control pills, condoms and other contraceptives for free. It would ..."
Filipinos demand right to divorce: 'We want to break free',https://newsinfo.inquirer.net/1777874/filipinos-demand-right-to-divorce-we-want-to-break-free,"A controversial birth control law was passed in 2012, despite strong opposition from the Church. And in 2018, majority and opposition ..."
Bebeng (International codename Aere) death toll rises to ...,https://newsinfo.inquirer.net/5938/bebeng-international-codename-aere-death-toll-rises-to-31-in-philippines,... birth control bill with sedi... EDITORS' PICK. BOC seizes P42 million worth of shabu at NAIA from a South African · Hurricane Milton: Fil-Am ...
"A step backward for women, HR activist says of DOH ...",https://newsinfo.inquirer.net/754943/a-step-backward-for-women-hr-activist-says-of-doh-budget-cut,“Congress' slashing of the budget for contraception is a ... contraceptive methods such as condoms.” Article continues after this ...
Bishops tell gov't: No free condoms on Valentine's Day,https://newsinfo.inquirer.net/143445/bishops-tell-gov%E2%80%99t-no-free-condoms-on-valentine%E2%80%99s-day,"... condoms and other forms of artificial contraceptives to Filipino couples during the special occasion ... control, not for sex liberalization. “Let ..."
Pacquiao as poster boy for Catholic Church,https://newsinfo.inquirer.net/6870/pacquiao-as-poster-boy-for-catholic-church,... condoms and birth control pills. So why do we still need to pass it when people are already using these?” Hahaha! Article continues after ...
INQUIRER.net Archives | Page 7627 of 14910,https://newsinfo.inquirer.net/source/inquirer-net/page/7627,"Woman inserts spring in vagina as birth control, still gets pregnant. September 17, 2019. Regions. BI nets 324 Chinese nationals 'involved in illegal ..."
Nakabawos ta batok sa Mexico gahapon,https://newsinfo.inquirer.net/325487/nakabawos-ta-batok-sa-mexico-gahapon,Iyang gikondenar ang paggamit sa magtiayon ug condom og ubang contraceptive method ug artificial birth control nga nakasupak sa kabubut-on sa ...
Philippines welcomes 100 millionth baby,https://newsinfo.inquirer.net/623749/philippines-welcomes-100-millionth-baby,"... law providing the poor with birth control services. Perez said with the law's implementation, about two to three million women who ..."
"Pacquiao stance vs RH bill is anti-poor, says workers' party",https://newsinfo.inquirer.net/6835/pacquiao-stance-vs-rh-bill-is-anti-poor-says-workers%E2%80%99-party,"Survey after survey has shown the majority wanting access to reproductive health, among them birth control which Jinkee has the privilege of ..."
"Rare, but healthy, quintuplets born in US",https://newsinfo.inquirer.net/417049/rare-but-healthy-quintuplets-born-in-us,The Centers for Disease Control and Prevention counted 37 babies ... birth pregnancy. Your subscription could not be saved. Please try ...
Duterte idea takes shape: Rehab center rises in Army camp,https://newsinfo.inquirer.net/817767/duterte-idea-takes-shape-rehab-center-rises-in-army-camp,"Cane, author of the ordinance that gave birth to Sure, said the rehab center would have a dormitory, administration building, toilets and ..."
6 boys barred from joining graduation over 'public kissing,https://newsinfo.inquirer.net/169117/catholic-school-bars-6-boys-from-joining-graduation-over-public-kissing%E2%80%99%E2%80%99,"... birth control. With AFP. READ NEXT. PNP chief orders probe on mall robbery. Tornado topples trees, shatters glass in Bacolod; floods hit C ..."
Reproductive Health Law takes effect,https://newsinfo.inquirer.net/342197/philippine-birth-control-law-takes-effect,"Under the law, government health centers will have to have a supply of contraceptives ... birth control services, she said. READ NEXT. Only 38 of ..."
Church leaders to closely monitor Sona on Monday,https://newsinfo.inquirer.net/29037/church-leaders-to-closely-monitor-sona-on-monday,"The bill also pushes the use of “modern” methods of family planning, including condoms, birth control pills, intrauterine devices and ..."
"Tour agencies offer PH passports, birth certificates to ...",https://newsinfo.inquirer.net/1235888/2-tour-agencies-allegedly-offer-chinese-nationals-ph-passports-birth-certificates-via-wechat-hontiveros,"... Control and Enforcement Unit (TCEU), duty Immigration supervisor, and terminal heads. READ: A P10 billion scheme: Alleged 'pastillas' modus ..."
Marines who killed Abu Sayyaf leader honored,https://newsinfo.inquirer.net/52019/marines-who-killed-abu-sayyaf-leader-honored,"... birth control aid just propaganda, s... EDITORS' PICK. Comelec: Five petitions to cancel candidacy for 2025 polls filed so far · Blinken at ..."
DOH seeking P600-M fund to fight HIV,https://newsinfo.inquirer.net/742856/doh-seeking-p600-m-fund-to-fight-hiv,The Department of Health (DOH) is seeking to double the budget allocation for human immunodeficiency virus (HIV) control and prevention to ...
"Don't trade faith for aid, 'Yolanda' victims urged",https://newsinfo.inquirer.net/618435/dont-trade-faith-for-aid-yolanda-victims-urged,"... birth control services. “This phenomenon is alarming,” he said in the CBCP article. “They violate Catholic norms of morality and many times ..."
INQUIRER.net Archives | Page 7631 of 14914,https://newsinfo.inquirer.net/source/inquirer-net/page/7631,"Woman inserts spring in vagina as birth control, still gets pregnant. September 17, 2019. Regions. BI nets 324 Chinese nationals 'involved in illegal ..."
"Beyond expletives, Duterte 'a man of the poor' - Ateneo de ...",https://newsinfo.inquirer.net/787504/beyond-expletives-duterte-a-man-of-the-poor-says-ateneo-de-davao-president,... birth control methods for families with multiple children. “Buti sana kung magbigay ang Katoliko ng honorarium (to families with multiple ...
"Trump win resets culture war debate on abortion, LGBT rights",https://newsinfo.inquirer.net/843994/trump-win-resets-culture-war-debate-on-abortion-lgbt-rights,"... birth control coverage requirement in the Affordable Care Act. Now, advocates see a transformed landscape. “We now have more equilibrium ..."
Turkey's Erdogan vows social media controls after insults ...,https://newsinfo.inquirer.net/1300382/turkeys-erdogan-vows-social-media-controls-after-insults-to-family,Turkey's president vowed Wednesday to tighten government control ... law when they announced the birth of their fourth child on Twitter.
CBCP: Arroyo welcome to join anti-RH rally,https://newsinfo.inquirer.net/240983/cbcp-arroyo-welcome-to-join-anti-rh-rally,"... birth control methods to use to plan their family sizes. Meanwhile, CBCP president and Cebu Archbishop Jose Palma warned Malacañang against ..."
Kansas attorney general sues to prevent transgender ...,https://newsinfo.inquirer.net/1798948/kansas-attorney-general-sues-to-prevent-transgender-people-from-changing-drivers-licenses,"... birth certificates to reflect their gender identities, Monday, June ... Laura Kelly, and agencies under her control, from letting transgender ..."
World | The latest from Inquirer News,https://newsinfo.inquirer.net/category/latest-stories/world-latest-stories/page/5090,"UK regulator says ad for birth control app were misleading. August 29, 2018. World. Hundreds of fish die in lagoon in tony Malibu, California. August 29, 2018."
2017 | Page 122 of 2794 | Inquirer News,https://newsinfo.inquirer.net/date/2017/page/122,2017 · Lucio Tan Jr. · Bato at Bilibid: Easy times for the well-behaved · Judge temporarily blocks new Trump rules on birth control · Trump doesn't want to talk ...
3 honored in 1st Paing Hechanova Youth Leadership Awards,https://newsinfo.inquirer.net/1927060/3-advocates-honored-in-1st-paing-hechanova-youth-leadership-awards,"For Madriaga, the alarming numbers may be due to ineffective information and birth control programs, as well as the prevailing stigmas and ..."
Birth of the first Philippine Republic,https://newsinfo.inquirer.net/425025/birth-of-the-first-philippine-republic,... control of much of the areas near and around Manila and they could have entered the walled city and taken it by their sheer number for most ...
Philippine Daily Inquirer Archives | Page 11019 of 11540,https://newsinfo.inquirer.net/source/-philippine-daily-inquirer/page/11019,"Report on scrapping of UN birth control aid just propaganda, says cardinal. September 02, 2011 BY: Jocelyn R. Uy. Metro. 2 men nabbed in QC buy-bust for ..."
Anti-abortion advocates march on Washington,https://newsinfo.inquirer.net/866169/anti-abortion-advocates-march-on-washington,"I believe in birth control pills.” 'Infuriated'. Brenda Kresak, a 40-year-old mother of six boys, brought her family to the march from ..."
Philip C. Tubeza Archives | Page 139 of 141 | Inquirer News,https://newsinfo.inquirer.net/byline/philip-c-tubeza/page/139,"Bishops urged to use charm in fight against birth control. April 23, 2011 BY: Philip C. Tubeza. Headlines. 'Only non-wage benefits on Labor Day'. April 19, 2011 ..."
Catholic Church 'show of force',https://newsinfo.inquirer.net/242323/catholic-church-show-of-force,"The Catholic Church views the Aug. 7 vote as a rush to impose birth control on the Filipinos. President Aquino supports the bill, and the Palace ..."
Tree growing in Tabunan,https://newsinfo.inquirer.net/218267/tree-growing-in-tabunan,... birth control to fight rabies. EDITORS' PICK. All the little ways endurance athletes can massively improve · NBA: Warriors hope 'disciplined ...
DOH confident SC will favor women's rights,https://newsinfo.inquirer.net/896714/doh-confident-sc-will-favor-womens-rights,"With the country's supply of contraceptives reduced by the 2015 TRO, women have switched from pills and implants—among those covered by the ..."
"Dipolog, Cagayan de Oro lead battle in curbing teenage ...",https://newsinfo.inquirer.net/1761834/dipolog-cagayan-de-oro-lead-battle-in-curbing-teenage-pregnancy,... birth rate for adolescent mothers through effective interventions ... ordinance last year. Aside from the city's well-developed and well ...
Deadlock over RH bill,https://newsinfo.inquirer.net/265566/senate-nears-compromise-bill-on-rh-scraps-sections-on-abortion-contraceptives,The Senate has removed controversial provisions that purportedly promote abortion and the use of birth control devices in a bid to break a ...
DOH tells pregnant women: Abstain from sex until after ...,https://newsinfo.inquirer.net/820458/doh-tells-pregnant-women-abstain-from-sex-until-after-delivery,"... condoms to protect them from getting infected with Zika virus ... Control and Prevention said Wednesday, Jan. 13, 2016, that it has found ..."
Responsible parenthood,https://newsinfo.inquirer.net/237111/responsible-parenthood,... birth control issue are even aware of the psychology of the RH campaign. Advocates have mounted the population control policy on the ...
RH groups lament SC ruling,https://newsinfo.inquirer.net/815856/rh-groups-lament-sc-ruling,"Issued in July 2015, the TRO prohibits the Department of Health from including contraceptive devices Implanon and Implanon NXT in its ..."
Cops call arrested pimp 'demon' - Suspect Jerrie Arraz,https://newsinfo.inquirer.net/651245/cops-call-arrested-pimp-demon,"After the consecutive ‎operations on Arraz, police have seized a number of sex toys, women's undergarments, pornographic pictures, birth control ..."
Siquijor aims to become 1st province to regulate plastic use,https://newsinfo.inquirer.net/1120915/siquijor-aims-to-become-1st-province-to-regulate-plastic-use,"... birth pains. Article continues after this advertisement. The ordinance, which came into effect in February, prohibits the use of plastic bags ..."
Aquino: I'd vote for RH bill if I were in the House,https://newsinfo.inquirer.net/317699/aquino-id-vote-for-rh-bill-if-i-were-in-the-house,"... birth control methods and bans contraceptives that prevent the implantation of a fertilized ovum, which is considered abortion by the ..."
Bato at Bilibid: Easy times for the well-behaved,https://newsinfo.inquirer.net/952843/bato-at-bilibid-easy-times-for-the-well-behaved,... birth control. EDITORS' PICK. Senate Pogo probe: Tony Yang admits he is also 'Antonio Lim' · Manila Water commits to marine protection on Int'l ...
Associated Press Archives | Page 1023 of 3057,https://newsinfo.inquirer.net/source/associated-press/page/1023,"California heads to court to fight Trump birth control rules. January 11, 2019. World. New dog museum unleashed in New York. January 11, 2019. World. At Mexican ..."
WATCH: Australian park rejoices in birth of first baby koala ...,https://newsinfo.inquirer.net/1283027/watch-australian-park-rejoices-in-birth-of-first-baby-koala-since-bushfires,One Australian “megablaze” was declared under control on Jan. 13. The organization International Fund for Animal Welfare (IFAW) stated that ...
"Gays, transgenders lash at Pacquiao's mom over ...",https://newsinfo.inquirer.net/8115/gays-transgenders-lash-at-pacquiao%E2%80%99s-mom-over-comments-on-contraceptives,"... contraceptive pills as breast enhancers. Goya Candelario ... birth control pills,” she added. Article continues after this ..."
Latest News Stories | The latest from Inquirer News,https://newsinfo.inquirer.net/category/latest-stories/page/10972,"CHEd OK with integration of birth control use in curriculum. August 27, 2020 BY: Krissy Aguilar. Metro. P10-M worth of smuggled cigarettes, unlicensed guns ..."
QC maternity clinics required to obtain licenses,https://newsinfo.inquirer.net/108155/qc-maternity-clinics-required-to-obtain-licenses,This is so because the City Council has passed the Birthing Homes Regulatory Ordinance which aims to impose strict requirements on such clinics ...
Franz Pumaren proposes anti-bullying month in Quezon City,https://newsinfo.inquirer.net/606692/franz-pumaran-proposes-anti-bullying-month-in-quezon-city,"The Quezon City Council is reviewing a draft ordinance that would declare October, its birth month, a period during which to campaign ..."
Ex-DENR exec charged with perjury,https://newsinfo.inquirer.net/875160/ex-denr-exec-charged-with-perjury#!,Former River Basin Control Office executive director Jacob Meimban Jr. ... Senate probe into fake birth certificates pushed · VP's Mindanao ...
6-month-old baby with heart and lung problems beats ...,https://newsinfo.inquirer.net/1266104/6-month-old-baby-with-heart-and-lung-problems-beats-covid-19,"... Control and Prevention, the said health problem is a birth defect that affects normal blood flow through a baby's heart. Article continues ..."
Duterte's RH EO tames top House critic,https://newsinfo.inquirer.net/861923/dutertes-rh-eo-tames-top-house-critic,It guarantees universal access to sex education and maternal care and methods on contraception and fertility control. ... contraceptive products.
Sotto warns he can filibuster on RH bill as regular senator,https://newsinfo.inquirer.net/243195/sotto-warns-he-can-filibuster-on-rh-bill-as-regular-senator,... contraceptives and other forms of artificial birth control pills to poor couples. FEATURED STORIES. NEWSINFO. Garma: Duterte rewarded cops for ...
Jealous man stabs ex-partner 11 times,https://newsinfo.inquirer.net/606119/jealous-man-stabs-ex-partner-11-times,... birth control pills and learned that she was being visited regularly at her work place by a man on a motorcycle. “I loved her but it ...
"Vote as Jesus would, prelate advises faithful",https://newsinfo.inquirer.net/390437/vote-as-jesus-would-prelate-advises-faithful,"... law. Article continues after this advertisement. But ... birth control and homosexual marriages, or candidates linked to illegal drugs."
Births in PH dropping sharply amid pandemic,https://newsinfo.inquirer.net/1546304/births-in-ph-dropping-sharply-amid-pandemic,... Law was aimed at slowing down the birth and fertility rates among women in the Philippines to control the ballooning population. It did not ...
Model goes blind after having eyeballs tattooed black,https://newsinfo.inquirer.net/1235783/model-goes-blind-in-one-eye-after-having-eyeballs-tattooed-black,"... birth control, still gets pregnant. ADVERTISEMENT. Double amputee, 9, set to walk in New York Fashion Week. Your subscription could not be ..."
Gays cry below the belt vs Pacmom's RH jab,https://newsinfo.inquirer.net/8856/gays-cry-below-the-belt-vs-pacmom%E2%80%99s-rh-jab,"“Tingnan mo mga bakla kaiinom ng pills, hindi na bagay inumin ng mga bakla kasi lalaki sila. ... birth control pills,” she said. Your subscription ..."
Pope Francis warns US bishops against 'divisive' language,https://newsinfo.inquirer.net/724853/pope-francis-warns-us-bishops-against-divisive-language,"... birth control. The bishops say they had no choice, given the advance of government policies they found immoral. As leaders of the largest ..."
"Pope arrives on historic trip to Cuba, US",https://newsinfo.inquirer.net/723660/pope-arrives-on-historic-trip-to-cuba-us,"... birth control coverage requirement in the Obama administration's health care plan. For Francis though, religious liberty also means ..."
Reply to Dr. Villegas,https://newsinfo.inquirer.net/83359/reply-to-dr-villegas,You call the use of contraceptives for birth control a solution that may have a short-term antipoverty impact but would lead to the social ...
US Catholic bishops try to calm anxiety over pope,https://newsinfo.inquirer.net/650005/us-catholic-bishops-try-to-calm-anxiety-over-pope,"... birth control coverage requirement in the Affordable Care Act, his signature health law. The administration has made several changes to ..."
DA orders probe of 'Q fever' cases in Marinduque,https://newsinfo.inquirer.net/1953449/da-orders-probe-of-q-fever-cases-in-marinduque,"The infectious disease, according to the webpage of the European Centre for Disease Prevention and Control ... birth. Symptoms. FEATURED ..."
Sotto can't believe Pope used phrase 'like rabbits',https://newsinfo.inquirer.net/666950/sotto-cant-believe-pope-used-phrase-like-rabbits,... Law requiring government health centers to provide free condoms and birth control pills. Stronger cooperation. “The focus of our government ...
Cebu bishop calls RH bill supporters no better than terrorists,https://newsinfo.inquirer.net/4131/cebu-bishop-calls-rh-bill-supporters-no-better-than-terrorists,... condoms and other methods of contraception that can cause abortion. Article continues after this advertisement. Palma expressed dismay with ...
Midwives on motorbikes spread sex sense in Cambodia,https://newsinfo.inquirer.net/10266/midwives-on-motorbikes-spread-sex-sense-in-cambodia,"... contraception options. She patiently waits for the giggles to subside when she points to a condom, aware that the two dozen women in the ..."
RH advocate Carlos Celdran guilty of offending Church,https://newsinfo.inquirer.net/348415/rh-advocate-carlos-celdran-guilty-of-offending-church,"... law requires government health centers to hand out free condoms and birth control pills, benefiting tens of millions of the country's poor ..."
Ukraine's president ends unilateral ceasefire,https://newsinfo.inquirer.net/615791/ukraines-president-ends-unilateral-ceasefire,"... birth control. Obama: 'I will act on my own on immigration'. EDITORS' PICK. PBA: Another Ginebra win, another Justin Brownlee masterclass."
"China eases one-child policy, abolishes labor camps",https://newsinfo.inquirer.net/553657/china-eases-one-child-policy-abolishes-labor-camps,... birth-control policy enforced in other parts of China. AFP. BEIJING – China's top legislative committee formally approved a loosening of the ...
PSA: Pandemic uncertainty a reason for lower births,https://newsinfo.inquirer.net/1546663/psa-pandemic-uncertainty-a-reason-for-lower-births,... Law was aimed at slowing down the birth and fertility rates among Filipino women to control the ballooning population. Separate PSA data had ...
Education will help curb teen pregnancy,https://newsinfo.inquirer.net/520435/education-will-help-curb-teen-pregnancy,"Jeah Gargarita stopped schooling when she was 17, after giving birth to her first child ... control. It is a consequence of little or no access to ..."
"Having more students an asset for dev't, says prelate vs RH ...",https://newsinfo.inquirer.net/262290/having-more-students-an-asset-for-devt-says-prelate-vs-rh-bill,"Palma is also against the mandatory sex education provision in the RH bill, which promotes birth control—both natural and modern methods."
WHO says delaying pregnancy option for women in Zika ...,https://newsinfo.inquirer.net/789999/who-says-delaying-pregnancy-option-for-women-in-zika-areas,And the US Centers for Disease Control and Prevention has additional advice for non-pregnant travelers: Women should wait at least eight weeks ...
